<?xml version="1.0" encoding="UTF-8" ?>
<sj:loggers xmlns:sj="http://sj-http-server.googlecode.com/logger"
    xmlns:xsi="http://www.w3.org/2001/XMLSchema-instance"
    xsi:schemaLocation="http://sj-http-server.googlecode.com/logger ../etc/sjlog.xsd">

    <sj:logger name="sj-server-logger" level="DEBUG">
        <sj:appenders>
            <sj:appender type="console"/>
            <sj:appender type="file">
                <sj:appenderParam name="filename">../work/logs/sjserver.log</sj:appenderParam>
                <sj:appenderParam name="rotated-file-timestamp-pattern">yyyy-MM-dd_hh-mm-ss-zzz</sj:appenderParam>
                <sj:appenderParam name="rotate-at-file-size-of">1048576</sj:appenderParam>
            </sj:appender>
        </sj:appenders>
    </sj:logger>

    <sj:logger name="sj-req-proc-thread-logger" level="TRACE">
        <sj:appenders>
            <sj:appender type="console"/>
            <sj:appender type="file">
                <sj:appenderParam name="filename">../work/logs/sjserver.log</sj:appenderParam>
            </sj:appender>
        </sj:appenders>
    </sj:logger>

    <sj:logger name="sj-http-dump-logger" level="INFO">
        <sj:appenders>
            <sj:appender type="file">
                <sj:appenderParam name="filename">../work/logs/http-dump.log</sj:appenderParam>
            </sj:appender>
        </sj:appenders>
    </sj:logger>

    <sj:logger name="sj-fortune-teller-logger" level="DEBUG">
        <sj:appenders>
            <sj:appender type="console"/>
            <sj:appender type="file">
                <sj:appenderParam name="filename">../work/logs/sjserver-ft.log</sj:appenderParam>
            </sj:appender>
        </sj:appenders>
    </sj:logger>

    <sj:logger name="sj-image-gallery-logger" level="DEBUG">
        <sj:appenders>
            <sj:appender type="console"/>
            <sj:appender type="file">
                <sj:appenderParam name="filename">../work/logs/sjserver-ig.log</sj:appenderParam>
            </sj:appender>
        </sj:appenders>
    </sj:logger>

</sj:loggers>
